### ISSUE TITLE
Can't authenticate in cluster with Rust Client

### ISSUE THREAD

**Issue by ADustyOldMuffin** [Altinity/clickhouse-operator#1121]
I'm using the rust client https://github.com/loyd/clickhouse.rs and I'm creating a client like so

```
let db = clickhouse::Client::default()
            .with_url(format!("{}?custom_http_params=async_insert=1,wait_for_async_insert=1,async_insert_busy_timeout_ms=5000", url))
            .with_user(user)
            .with_password(pass);
```

Which works fine when using docker-compose.

I have the clickhouse settings

```
    users:
      test/password: test_pass
      # allow all traffic from in the cluster
      test_user/networks/host_regexp: '.*$' 
```

and I'm specifying the params to the pod as so

```
          - name: DB_URL
            value: http://chi-test-ch-standard-0-0-0.chi-tast-ch-standard-0-0.test.svc.cluster.local:8123
          - name: DB_USER
            value: test_user
          - name: DB_PASS
            value: test_pass
```

But the pod fails on startup with 
```
Error: failed to initialize data store

Caused by:
    bad response: Code: 516. DB::Exception: test_user: Authentication failed: password is incorrect, or there is no user with such name. (AUTHENTICATION_FAILED) (version 23.2.2.20 (official build))
```

I hopped into another pod in the cluster with curl and tested that I can actually hit it
```
echo 'SHOW DATABASES' | curl 'http://chi-test-ch-standard-0-0-0.chi-test-ch-standard-0-0.test.svc.cluster.local:8123?user=test_user&password=test_pass' --data-binary @-
INFORMATION_SCHEMA
default
information_schema
system
```

which works fine, and I can access and use the UI query playground fine. Am I missing something?

**Comment by Slach** [comment]
Could you try to install https://github.com/eldadru/ksniff
and try to capture traffic from your rust pod in port 8123
and traffic from your clickhouse pod for port 53 


moreover, according to https://github.com/loyd/clickhouse.rs/blob/bc2808e63b98cee05aca68b463fdc893656d46da/src/query.rs#L119-L125

try to execute and share results 
```
echo 'SHOW DATABASES' | curl -H 'X-ClickHouse-User: test_user' -H 'X-ClickHouse-Key: test_pass' http://chi-test-ch-standard-0-0-0.chi-test-ch-standard-0-0.test.svc.cluster.local:8123' --data-binary @-
```
inside rust pod?

**Comment by ADustyOldMuffin** [comment]
Notice I changed the names before from abysm to test for the issue, but I these are the raw captures. In the initial comment anything that was `test` is actually `abysm`.

Clickhouse Incoming request
```
Frame 788: 309 bytes on wire (2472 bits), 309 bytes captured (2472 bits) on interface -, id 0
Linux cooked capture v1
Internet Protocol Version 4, Src: 10.244.0.54, Dst: 10.244.0.44
Transmission Control Protocol, Src Port: 33582, Dst Port: 8123, Seq: 1, Ack: 1, Len: 241
Hypertext Transfer Protocol
    POST /?compress=1 HTTP/1.1\r\n
    content-length: 40\r\n
    x-clickhouse-user: abysm_user\r\n
    x-clickhouse-key: abysm_pass\r\n
    host: chi-abysm-ch-standard-0-0-0.chi-abysm-ch-standard-0-0.abysm.svc.cluster.local:8123\r\n
    \r\n
    [Full request URI: http://chi-abysm-ch-standard-0-0-0.chi-abysm-ch-standard-0-0.abysm.svc.cluster.local:8123/?compress=1]
    [HTTP request 1/1]
    [Response in frame: 796]
    File Data: 40 bytes
    Data (40 bytes)

0000  43 52 45 41 54 45 20 44 41 54 41 42 41 53 45 20   CREATE DATABASE
0010  49 46 20 4e 4f 54 20 45 58 49 53 54 53 20 61 62   IF NOT EXISTS ab
0020  79 73 6d 5f 6c 6f 67 73                           ysm_logs
        Data: 435245415445204441544142415345204946204e4f542045584953545320616279736d5f…
        [Length: 40]

No.     Time           Source                Destination           Protocol Length Info
    789 70.353367      10.244.0.44           10.244.0.54           TCP      68     8123 → 33582 [ACK] Seq=1 Ack=242 Win=65024 Len=0 TSval=851783747 TSecr=2761835692
```
Clickhouse Response
```
Frame 796: 73 bytes on wire (584 bits), 73 bytes captured (584 bits) on interface -, id 0
Linux cooked capture v1
Internet Protocol Version 4, Src: 10.244.0.44, Dst: 10.244.0.54
Transmission Control Protocol, Src Port: 8123, Dst Port: 33582, Seq: 491, Ack: 242, Len: 5
[3 Reassembled TCP Segments (495 bytes): #792(303), #794(187), #796(5)]
Hypertext Transfer Protocol
    HTTP/1.1 403 Forbidden\r\n
    Date: Fri, 03 Mar 2023 19:35:25 GMT\r\n
    Connection: Keep-Alive\r\n
    Content-Type: text/plain; charset=UTF-8\r\n
    X-ClickHouse-Server-Display-Name: chi-abysm-ch-standard-0-0-0.chi-abysm-ch-standard-0-0.abysm.svc.cluster.local\r\n
    Transfer-Encoding: chunked\r\n
    X-ClickHouse-Exception-Code: 516\r\n
    \r\n
    [HTTP response 1/1]
    [Time since request: 0.045369000 seconds]
    [Request in frame: 788]
    [Request URI: http://chi-abysm-ch-standard-0-0-0.chi-abysm-ch-standard-0-0.abysm.svc.cluster.local:8123/?compress=1]
    HTTP chunked response
    File Data: 181 bytes
Line-based text data: text/plain (1 lines)

No.     Time           Source                Destination           Protocol Length Info
    797 70.398727      10.244.0.54           10.244.0.44           TCP      68     33582 → 8123 [ACK] Seq=242 Ack=496 Win=64128 Len=0 TSval=2761835737 TSecr=851783792
```

Rust pod Request
```
Frame 34: 309 bytes on wire (2472 bits), 309 bytes captured (2472 bits) on interface -, id 0
Linux cooked capture v1
Internet Protocol Version 4, Src: 10.244.0.54, Dst: 10.244.0.44
Transmission Control Protocol, Src Port: 49446, Dst Port: 8123, Seq: 1, Ack: 1, Len: 241
Hypertext Transfer Protocol
    POST /?compress=1 HTTP/1.1\r\n
    content-length: 40\r\n
    x-clickhouse-user: abysm_user\r\n
    x-clickhouse-key: abysm_pass\r\n
    host: chi-abysm-ch-standard-0-0-0.chi-abysm-ch-standard-0-0.abysm.svc.cluster.local:8123\r\n
    \r\n
    [Full request URI: http://chi-abysm-ch-standard-0-0-0.chi-abysm-ch-standard-0-0.abysm.svc.cluster.local:8123/?compress=1]
    [HTTP request 1/1]
    [Response in frame: 40]
    File Data: 40 bytes
    Data (40 bytes)

0000  43 52 45 41 54 45 20 44 41 54 41 42 41 53 45 20   CREATE DATABASE
0010  49 46 20 4e 4f 54 20 45 58 49 53 54 53 20 61 62   IF NOT EXISTS ab
0020  79 73 6d 5f 6c 6f 67 73                           ysm_logs

No.     Time           Source                Destination           Protocol Length Info
     35 0.001541       10.244.0.44           10.244.0.54           TCP      68     8123 → 49446 [ACK] Seq=1 Ack=242 Win=65024 Len=0 TSval=852614970 TSecr=2762666915
```

Rust pod Response 
```
Frame 40: 73 bytes on wire (584 bits), 73 bytes captured (584 bits) on interface -, id 0
Linux cooked capture v1
Internet Protocol Version 4, Src: 10.244.0.44, Dst: 10.244.0.54
Transmission Control Protocol, Src Port: 8123, Dst Port: 49446, Seq: 491, Ack: 242, Len: 5
[3 Reassembled TCP Segments (495 bytes): #36(303), #38(187), #40(5)]
Hypertext Transfer Protocol
    HTTP/1.1 403 Forbidden\r\n
    Date: Fri, 03 Mar 2023 19:49:16 GMT\r\n
    Connection: Keep-Alive\r\n
    Content-Type: text/plain; charset=UTF-8\r\n
    X-ClickHouse-Server-Display-Name: chi-abysm-ch-standard-0-0-0.chi-abysm-ch-standard-0-0.abysm.svc.cluster.local\r\n
    Transfer-Encoding: chunked\r\n
    X-ClickHouse-Exception-Code: 516\r\n
    \r\n
    [HTTP response 1/1]
    [Time since request: 0.045256000 seconds]
    [Request in frame: 34]
    [Request URI: http://chi-abysm-ch-standard-0-0-0.chi-abysm-ch-standard-0-0.abysm.svc.cluster.local:8123/?compress=1]
    HTTP chunked response
    File Data: 181 bytes
Line-based text data: text/plain (1 lines)

No.     Time           Source                Destination           Protocol Length Info
     41 0.046773       10.244.0.54           10.244.0.44           TCP      68     49446 → 8123 [ACK] Seq=242 Ack=496 Win=64128 Len=0 TSval=2762666960 TSecr=852615015
```

**Comment by Slach** [comment]
could you try 
`nslookup -type=PTR 10.244.0.54` inside clickhouse pod?

also try run `SYSTEM DROP DNS CACHE;` from clickhouse-client

and check authorization by IP
```yaml
 users:
      test/password: test_pass
      # allow all traffic from in pod network
      test_user/networks/ip: '10.244.0.0/16' 
```

**Comment by ADustyOldMuffin** [comment]
I have another Rust pod that doesn't interact with the DB, but that's where I can get the request to go through with curl. Note they are both in the same namespace, just different pods.

CURL from good pod
Request
```
Frame 8: 360 bytes on wire (2880 bits), 360 bytes captured (2880 bits) on interface -, id 0
Linux cooked capture v1
Internet Protocol Version 4, Src: 10.244.0.40, Dst: 10.244.0.44
Transmission Control Protocol, Src Port: 38894, Dst Port: 8123, Seq: 1, Ack: 1, Len: 292
Hypertext Transfer Protocol
    POST / HTTP/1.1\r\n
    Host: chi-abysm-ch-standard-0-0-0.chi-abysm-ch-standard-0-0.abysm.svc.cluster.local:8123\r\n
    User-Agent: curl/7.74.0\r\n
    Accept: */*\r\n
    X-Clickhouse-User: abysm_user\r\n
    X-Clickhouse-Key: abysm_pass\r\n
    Content-Length: 15\r\n
    Content-Type: application/x-www-form-urlencoded\r\n
    \r\n
    [Full request URI: http://chi-abysm-ch-standard-0-0-0.chi-abysm-ch-standard-0-0.abysm.svc.cluster.local:8123/]
    [HTTP request 1/1]
    [Response in frame: 16]
    File Data: 15 bytes
HTML Form URL Encoded: application/x-www-form-urlencoded

No.     Time           Source                Destination           Protocol Length Info
      9 0.000430       10.244.0.44           10.244.0.40           TCP      68     8123 → 38894 [ACK] Seq=1 Ack=293 Win=64896 Len=0 TSval=2683728055 TSecr=3680299152
```

Response
```
Frame 16: 73 bytes on wire (584 bits), 73 bytes captured (584 bits) on interface -, id 0
Linux cooked capture v1
Internet Protocol Version 4, Src: 10.244.0.44, Dst: 10.244.0.40
Transmission Control Protocol, Src Port: 8123, Dst Port: 38894, Seq: 650, Ack: 293, Len: 5
[4 Reassembled TCP Segments (654 bytes): #10(583), #12(2), #14(64), #16(5)]
Hypertext Transfer Protocol
    HTTP/1.1 200 OK\r\n
    Date: Fri, 03 Mar 2023 20:03:04 GMT\r\n
    Connection: Keep-Alive\r\n
    Content-Type: text/tab-separated-values; charset=UTF-8\r\n
    X-ClickHouse-Server-Display-Name: chi-abysm-ch-standard-0-0-0.chi-abysm-ch-standard-0-0.abysm.svc.cluster.local\r\n
    Transfer-Encoding: chunked\r\n
    X-ClickHouse-Query-Id: 40d919b3-7be4-4cb8-98e1-dd0076c5f7e5\r\n
    X-ClickHouse-Format: TabSeparated\r\n
    X-ClickHouse-Timezone: UTC\r\n
    Keep-Alive: timeout=3\r\n
    X-ClickHouse-Summary: {"read_rows":"5","read_bytes":"782","written_rows":"0","written_bytes":"0","total_rows_to_read":"0","result_rows":"0","result_bytes":"0"}\r\n
    \r\n
    [HTTP response 1/1]
    [Time since request: 0.002742000 seconds]
    [Request in frame: 8]
    [Request URI: http://chi-abysm-ch-standard-0-0-0.chi-abysm-ch-standard-0-0.abysm.svc.cluster.local:8123/]
    HTTP chunked response
    File Data: 58 bytes
Media Type
No.     Time           Source                Destination           Protocol Length Info
     17 0.003168       10.244.0.40           10.244.0.44           TCP      68     38894 → 8123 [ACK] Seq=293 Ack=655 Win=64128 Len=0 TSval=3680299155 TSecr=2683728058
```

CURL from bad pod
request
```
Frame 8: 360 bytes on wire (2880 bits), 360 bytes captured (2880 bits) on interface -, id 0
Linux cooked capture v1
Internet Protocol Version 4, Src: 10.244.0.54, Dst: 10.244.0.44
Transmission Control Protocol, Src Port: 48516, Dst Port: 8123, Seq: 1, Ack: 1, Len: 292
Hypertext Transfer Protocol
    POST / HTTP/1.1\r\n
    Host: chi-abysm-ch-standard-0-0-0.chi-abysm-ch-standard-0-0.abysm.svc.cluster.local:8123\r\n
    User-Agent: curl/7.74.0\r\n
    Accept: */*\r\n
    X-ClickHouse-User: abysm_user\r\n
    X-ClickHouse-Key: abysm_pass\r\n
    Content-Length: 15\r\n
    Content-Type: application/x-www-form-urlencoded\r\n
    \r\n
    [Full request URI: http://chi-abysm-ch-standard-0-0-0.chi-abysm-ch-standard-0-0.abysm.svc.cluster.local:8123/]
    [HTTP request 1/1]
    [Response in frame: 14]
    File Data: 15 bytes
HTML Form URL Encoded: application/x-www-form-urlencoded

No.     Time           Source                Destination           Protocol Length Info
      9 0.000485       10.244.0.44           10.244.0.54           TCP      68     8123 → 48516 [ACK] Seq=1 Ack=293 Win=64896 Len=0 TSval=853676179 TSecr=2763728124
```

Response 
```
Frame 14: 73 bytes on wire (584 bits), 73 bytes captured (584 bits) on interface -, id 0
Linux cooked capture v1
Internet Protocol Version 4, Src: 10.244.0.44, Dst: 10.244.0.54
Transmission Control Protocol, Src Port: 8123, Dst Port: 48516, Seq: 491, Ack: 293, Len: 5
[3 Reassembled TCP Segments (495 bytes): #10(303), #12(187), #14(5)]
Hypertext Transfer Protocol
    HTTP/1.1 403 Forbidden\r\n
    Date: Fri, 03 Mar 2023 20:06:57 GMT\r\n
    Connection: Keep-Alive\r\n
    Content-Type: text/plain; charset=UTF-8\r\n
    X-ClickHouse-Server-Display-Name: chi-abysm-ch-standard-0-0-0.chi-abysm-ch-standard-0-0.abysm.svc.cluster.local\r\n
    Transfer-Encoding: chunked\r\n
    X-ClickHouse-Exception-Code: 516\r\n
    \r\n
    [HTTP response 1/1]
    [Time since request: 0.045686000 seconds]
    [Request in frame: 8]
    [Request URI: http://chi-abysm-ch-standard-0-0-0.chi-abysm-ch-standard-0-0.abysm.svc.cluster.local:8123/]
    HTTP chunked response
    File Data: 181 bytes
Line-based text data: text/plain (1 lines)

No.     Time           Source                Destination           Protocol Length Info
     15 0.046165       10.244.0.54           10.244.0.44           TCP      68     48516 → 8123 [ACK] Seq=293 Ack=496 Win=64128 Len=0 TSval=2763728170 TSecr=853676225
```

**Comment by ADustyOldMuffin** [comment]
nslookup for the pod making the request fails

```
root@chi-abysm-ch-standard-0-0-0:/# nslookup -type=PTR 10.244.0.54
Server:         10.96.0.10
Address:        10.96.0.10#53

** server can't find 54.0.244.10.in-addr.arpa: NXDOMAIN
```

ran the drop cache and no luck, trying to add the pod IP range.

**Comment by Slach** [comment]
look like your rust pod ip doesn't resolve by PTR DNS request
and host_regexp is not applicable
do you have any `kind: Service` which cover your rust client pod?

**Comment by ADustyOldMuffin** [comment]
No I do not as it's not something that's meant to be reached, and that makes sense since it wouldn't make a DNS entry for it. I added the `abysm_user/networks/ip: '10.244.0.0/16'` and it now works! I'm guessing the issue is Clickhouse was trying to resolve the IP/DNS name to see if it should be allowed and since there is none it didn't work?

**Comment by Slach** [comment]
if DNS PTR request not  return answer host_regexp is not applicable

**Comment by ADustyOldMuffin** [comment]
Thanks so much!
